{
  "$schema": "https://json-schema.org/draft/2020-12/schema",
  "title": "ProcedureCatalog",
  "description": "Per-procedure catalog file produced by setup-ddl. Contains outbound references and inbound callers.",
  "type": "object",
  "required": ["schema", "name", "references", "mode", "routing_reasons"],
  "properties": {
    "schema": { "type": "string", "description": "Schema name, e.g. silver" },
    "name": { "type": "string", "description": "Object name, e.g. usp_load_DimCustomer" },
    "ddl_hash": { "type": "string", "description": "SHA-256 of normalized source DDL. Used for diff-aware reexport." },
    "stale": { "type": "boolean", "description": "True when the object was present in a prior extraction but absent in the latest." },
    "params": {
      "type": "array",
      "description": "Procedure parameters from sys.parameters.",
      "items": {
        "type": "object",
        "required": ["name", "sql_type"],
        "properties": {
          "name": { "type": "string", "description": "Parameter name including @, e.g. @CustomerId" },
          "sql_type": { "type": "string" },
          "is_output": { "type": "boolean" },
          "has_default": { "type": "boolean" }
        }
      }
    },
    "needs_llm": {
      "type": "boolean",
      "description": "True when body contains EXEC(@var), TRY/CATCH, WHILE, or IF/ELSE. Set by body scan during export."
    },
    "needs_enrich": {
      "type": "boolean",
      "description": "True when body contains SELECT INTO, TRUNCATE, or static EXEC chains. Flipped to false by catalog-enrich."
    },
    "mode": {
      "type": "string",
      "enum": ["deterministic", "control_flow_fallback", "call_graph_enrich", "dynamic_sql_literal", "llm_required"],
      "description": "Canonical routing mode for this procedure."
    },
    "routing_reasons": {
      "type": "array",
      "description": "Canonical routing reasons detected for this procedure.",
      "items": {
        "type": "string",
        "enum": [
          "if_else",
          "while_loop",
          "try_catch",
          "static_exec",
          "dynamic_sql_literal",
          "dynamic_sql_variable",
          "unsupported_syntax",
          "depth_limit_exceeded"
        ]
      }
    },
    "references": {
      "type": "object",
      "description": "Outbound: what this procedure depends on.",
      "required": ["tables", "views", "functions", "procedures"],
      "properties": {
        "tables": { "$ref": "common.json#/$defs/scoped_ref_list" },
        "views": { "$ref": "common.json#/$defs/scoped_ref_list" },
        "functions": { "$ref": "common.json#/$defs/scoped_ref_list" },
        "procedures": { "$ref": "common.json#/$defs/scoped_ref_list" }
      }
    },
    "referenced_by": {
      "type": "object",
      "description": "Inbound: what calls this procedure.",
      "required": ["procedures"],
      "properties": {
        "procedures": { "$ref": "common.json#/$defs/scoped_ref_list" }
      }
    },
    "statements": {
      "type": "array",
      "description": "Resolved statement classification. Written by the analyzing-table skill (procedure analysis reference) after all needs_llm actions are resolved to migrate or skip.",
      "items": {
        "type": "object",
        "required": ["action", "source", "sql"],
        "properties": {
          "type": { "type": "string", "description": "Statement type, e.g. Insert, Update, Merge, Command." },
          "action": { "type": "string", "enum": ["migrate", "skip"], "description": "migrate: core DML that becomes the dbt model. skip: operational overhead." },
          "source": { "type": "string", "enum": ["ast", "llm"], "description": "How the action was determined: ast (deterministic sqlglot parse) or llm (Claude analysis of dynamic SQL/call graph)." },
          "sql": { "type": "string", "description": "SQL text of the statement." },
          "rationale": { "type": "string", "description": "Why this statement is migrate or skip. Required for source: llm; optional for source: ast." }
        }
      }
    }
  }
}
