{
  "schema": "silver",
  "name": "usp_load_crossjointarget",
  "references": {
    "tables": {
      "in_scope": [
        {
          "schema": "bronze",
          "name": "Product",
          "is_selected": true,
          "is_updated": false,
          "columns": [
            { "name": "ProductID", "is_selected": true, "is_updated": false },
            { "name": "ProductName", "is_selected": true, "is_updated": false },
            { "name": "SellEndDate", "is_selected": true, "is_updated": false }
          ]
        },
        {
          "schema": "bronze",
          "name": "SalesTerritory",
          "is_selected": true,
          "is_updated": false,
          "columns": [
            { "name": "TerritoryID", "is_selected": true, "is_updated": false },
            { "name": "TerritoryName", "is_selected": true, "is_updated": false }
          ]
        },
        {
          "schema": "silver",
          "name": "CrossJoinTarget",
          "is_selected": false,
          "is_updated": true,
          "columns": [
            { "name": "ProductKey", "is_selected": false, "is_updated": true },
            { "name": "TerritoryId", "is_selected": false, "is_updated": true },
            { "name": "ProductName", "is_selected": false, "is_updated": true },
            { "name": "TerritoryName", "is_selected": false, "is_updated": true }
          ]
        }
      ],
      "out_of_scope": []
    },
    "views": { "in_scope": [], "out_of_scope": [] },
    "functions": { "in_scope": [], "out_of_scope": [] },
    "procedures": { "in_scope": [], "out_of_scope": [] }
  },
  "mode": "deterministic",
  "routing_reasons": [],
  "statements": [
    {
      "type": "Insert",
      "action": "migrate",
      "source": "ast",
      "sql": "INSERT INTO silver.CrossJoinTarget (ProductKey, TerritoryId, ProductName, TerritoryName) SELECT p.ProductID, t.TerritoryID, p.ProductName, t.TerritoryName FROM bronze.Product AS p CROSS JOIN bronze.SalesTerritory AS t WHERE p.SellEndDate IS NULL"
    }
  ]
}
