{
  "schema": "dbo",
  "name": "usp_helper_prep",
  "mode": "deterministic",
  "routing_reasons": [],
  "statements": [
    {"action": "migrate", "source": "ast", "sql": "SELECT * FROM silver.DimDate"}
  ],
  "references": {
    "tables": {
      "in_scope": [
        {"schema": "silver", "name": "DimDate", "is_selected": true, "is_updated": false, "is_insert_all": false, "is_schema_bound": false, "is_caller_dependent": false, "is_ambiguous": false, "detection": "catalog_query", "columns": []}
      ],
      "out_of_scope": []
    },
    "views": {"in_scope": [], "out_of_scope": []},
    "functions": {"in_scope": [], "out_of_scope": []},
    "procedures": {"in_scope": [], "out_of_scope": []}
  },
  "referenced_by": {"procedures": {"in_scope": [], "out_of_scope": []}}
}
