{
  "schema": "silver",
  "name": "usp_load_excepttarget",
  "references": {
    "tables": {
      "in_scope": [
        {
          "schema": "bronze",
          "name": "Product",
          "is_selected": true,
          "is_updated": false,
          "columns": [
            { "name": "ProductID", "is_selected": true, "is_updated": false },
            { "name": "MakeFlag", "is_selected": true, "is_updated": false },
            { "name": "SellEndDate", "is_selected": true, "is_updated": false }
          ]
        },
        {
          "schema": "silver",
          "name": "ExceptTarget",
          "is_selected": false,
          "is_updated": true,
          "columns": [
            { "name": "ProductAlternateKey", "is_selected": false, "is_updated": true }
          ]
        }
      ],
      "out_of_scope": []
    },
    "views": { "in_scope": [], "out_of_scope": [] },
    "functions": { "in_scope": [], "out_of_scope": [] },
    "procedures": { "in_scope": [], "out_of_scope": [] }
  },
  "mode": "deterministic",
  "routing_reasons": [],
  "statements": [
    {
      "type": "Insert",
      "action": "migrate",
      "source": "ast",
      "sql": "INSERT INTO silver.ExceptTarget (ProductAlternateKey) SELECT CAST(ProductID AS NVARCHAR(25)) FROM bronze.Product WHERE MakeFlag = 1 EXCEPT SELECT CAST(ProductID AS NVARCHAR(25)) FROM bronze.Product WHERE SellEndDate IS NOT NULL"
    }
  ]
}
