{
  "schema": "silver",
  "name": "usp_load_recursivectetarget",
  "references": {
    "tables": {
      "in_scope": [
        {
          "schema": "silver",
          "name": "RecursiveCteTarget",
          "is_selected": false,
          "is_updated": true,
          "columns": [
            { "name": "OrgLevel", "is_selected": false, "is_updated": false },
            { "name": "ManagerId", "is_selected": false, "is_updated": false },
            { "name": "EmployeeId", "is_selected": false, "is_updated": false },
            { "name": "FullPath", "is_selected": false, "is_updated": false }
          ]
        }
      ],
      "out_of_scope": [
        {
          "schema": "bronze",
          "name": "Employee",
          "is_selected": true,
          "is_updated": false,
          "columns": []
        }
      ]
    },
    "views": { "in_scope": [], "out_of_scope": [] },
    "functions": { "in_scope": [], "out_of_scope": [] },
    "procedures": { "in_scope": [], "out_of_scope": [] }
  },
  "mode": "deterministic",
  "routing_reasons": [],
  "statements": [
    {
      "type": "Insert",
      "action": "migrate",
      "source": "ast",
      "sql": "WITH org AS (SELECT 0 AS OrgLevel, NULL AS ManagerId, EmployeeID AS EmployeeId, CAST(LastName AS NVARCHAR(100)) AS FullPath FROM bronze.Employee WHERE ManagerID IS NULL UNION ALL SELECT o.OrgLevel + 1, e.ManagerID, e.EmployeeID, CAST(o.FullPath + ' > ' + e.LastName AS NVARCHAR(100)) FROM bronze.Employee AS e JOIN org AS o ON e.ManagerID = o.EmployeeId) INSERT INTO silver.RecursiveCteTarget (OrgLevel, ManagerId, EmployeeId, FullPath) SELECT OrgLevel, ManagerId, EmployeeId, FullPath FROM org"
    }
  ]
}
