{
  "schema": "silver",
  "name": "usp_load_trycatchtarget",
  "references": {
    "tables": {
      "in_scope": [
        {
          "schema": "silver",
          "name": "TryCatchTarget",
          "is_selected": false,
          "is_updated": true,
          "columns": [
            { "name": "ProductAlternateKey", "is_selected": false, "is_updated": false },
            { "name": "EnglishProductName", "is_selected": false, "is_updated": false }
          ]
        }
      ],
      "out_of_scope": [
        {
          "schema": "bronze",
          "name": "Product",
          "is_selected": true,
          "is_updated": false,
          "columns": []
        }
      ]
    },
    "views": { "in_scope": [], "out_of_scope": [] },
    "functions": { "in_scope": [], "out_of_scope": [] },
    "procedures": { "in_scope": [], "out_of_scope": [] }
  },
  "mode": "deterministic",
  "routing_reasons": [],
  "statements": [
    {
      "type": "Insert",
      "action": "migrate",
      "source": "ast",
      "sql": "INSERT INTO silver.TryCatchTarget (ProductAlternateKey, EnglishProductName) SELECT CAST(ProductID AS NVARCHAR(25)), ProductName FROM bronze.Product WHERE ProductName IS NOT NULL"
    }
  ]
}
