{
  "schema": "silver",
  "name": "usp_load_notintarget",
  "references": {
    "tables": {
      "in_scope": [
        {
          "schema": "bronze",
          "name": "Product",
          "is_selected": true,
          "is_updated": false,
          "columns": [
            { "name": "ProductID", "is_selected": true, "is_updated": false },
            { "name": "ProductName", "is_selected": true, "is_updated": false }
          ]
        },
        {
          "schema": "bronze",
          "name": "SalesOrderDetail",
          "is_selected": true,
          "is_updated": false,
          "columns": [
            { "name": "ProductID", "is_selected": true, "is_updated": false }
          ]
        },
        {
          "schema": "silver",
          "name": "NotInTarget",
          "is_selected": false,
          "is_updated": true,
          "columns": [
            { "name": "ProductAlternateKey", "is_selected": false, "is_updated": true },
            { "name": "EnglishProductName", "is_selected": false, "is_updated": true }
          ]
        }
      ],
      "out_of_scope": []
    },
    "views": { "in_scope": [], "out_of_scope": [] },
    "functions": { "in_scope": [], "out_of_scope": [] },
    "procedures": { "in_scope": [], "out_of_scope": [] }
  },
  "mode": "deterministic",
  "routing_reasons": [],
  "statements": [
    {
      "type": "Insert",
      "action": "migrate",
      "source": "ast",
      "sql": "INSERT INTO silver.NotInTarget (ProductAlternateKey, EnglishProductName) SELECT CAST(ProductID AS NVARCHAR(25)), ProductName FROM bronze.Product WHERE ProductID NOT IN (SELECT ProductID FROM bronze.SalesOrderDetail)"
    }
  ]
}
