{
  "schema": "silver",
  "name": "usp_load_unionallctetarget",
  "references": {
    "tables": {
      "in_scope": [
        {
          "schema": "bronze",
          "name": "Product",
          "is_selected": true,
          "is_updated": false,
          "columns": [
            { "name": "ProductID", "is_selected": true, "is_updated": false },
            { "name": "ProductName", "is_selected": true, "is_updated": false },
            { "name": "SellEndDate", "is_selected": true, "is_updated": false }
          ]
        },
        {
          "schema": "silver",
          "name": "UnionAllCteTarget",
          "is_selected": false,
          "is_updated": true,
          "columns": [
            { "name": "ProductAlternateKey", "is_selected": false, "is_updated": true },
            { "name": "EnglishProductName", "is_selected": false, "is_updated": true },
            { "name": "Segment", "is_selected": false, "is_updated": true }
          ]
        }
      ],
      "out_of_scope": []
    },
    "views": { "in_scope": [], "out_of_scope": [] },
    "functions": { "in_scope": [], "out_of_scope": [] },
    "procedures": { "in_scope": [], "out_of_scope": [] }
  },
  "mode": "deterministic",
  "routing_reasons": [],
  "statements": [
    {
      "type": "Insert",
      "action": "migrate",
      "source": "ast",
      "sql": "WITH src AS (SELECT CAST(ProductID AS NVARCHAR(25)) AS ProductAlternateKey, ProductName, 'active' AS Segment FROM bronze.Product WHERE SellEndDate IS NULL UNION ALL SELECT CAST(ProductID AS NVARCHAR(25)), ProductName, 'discontinued' FROM bronze.Product WHERE SellEndDate IS NOT NULL) INSERT INTO silver.UnionAllCteTarget (ProductAlternateKey, EnglishProductName, Segment) SELECT ProductAlternateKey, ProductName, Segment FROM src"
    }
  ]
}
