{
  "schema": "silver",
  "name": "usp_load_selectintotarget",
  "references": {
    "tables": {
      "in_scope": [
        {
          "schema": "bronze",
          "name": "Product",
          "is_selected": true,
          "is_updated": false,
          "columns": [
            {
              "name": "ProductID",
              "is_selected": true,
              "is_updated": false
            },
            {
              "name": "ProductName",
              "is_selected": true,
              "is_updated": false
            }
          ]
        },
        {
          "schema": "silver",
          "name": "SelectIntoTarget",
          "is_selected": false,
          "is_updated": true,
          "columns": [
            {
              "name": "ProductAlternateKey",
              "is_selected": false,
              "is_updated": true
            },
            {
              "name": "EnglishProductName",
              "is_selected": false,
              "is_updated": true
            }
          ]
        }
      ],
      "out_of_scope": []
    },
    "views": {
      "in_scope": [],
      "out_of_scope": []
    },
    "functions": {
      "in_scope": [],
      "out_of_scope": []
    },
    "procedures": {
      "in_scope": [],
      "out_of_scope": []
    }
  },
  "mode": "deterministic",
  "routing_reasons": [],
  "statements": [
    {
      "type": "SelectInto",
      "action": "migrate",
      "source": "ast",
      "sql": "SELECT CAST(ProductID AS NVARCHAR(25)) AS ProductAlternateKey, ProductName AS EnglishProductName INTO silver.SelectIntoTarget FROM bronze.Product"
    }
  ]
}
